{
  "id": "10kswap",
  "displayName": "10KSwap",
  "host": "10kswap.com",
  "description": "10KSwap is a Layer 2 AMM protocol building on Starknet",
  "categories": [
    "defi"
  ],
  "contracts": [
    {
      "tag": "10k_swap_address",
      "addresses": {
        "goerli-alpha": [
          "0x00975910cd99bc56bd289eaaa5cee6cd557f0ddafdb2ce6ebea15b158eb2c664"
        ],
        "mainnet-alpha": [
          "0x07a6f98c03379b9513ca84cca1373ff452a7462a3b61598f0af5bb27ad7f76d1"
        ]
      }
    },
    {
      "tag": "10k_swap_factory",
      "addresses": {
        "goerli-alpha": [
          "0x06c31f39524388c982045988de3788530605ed08b10389def2e7b1dd09d19308"
        ],
        "mainnet-alpha": [
          "0x01c0a36e26a8f822e0d81f20a5a562b16a8f8a3dfd99801367dd2aea8f1a87a2"
        ]
      }
    }
  ]
}
