{
  "id": "starknetid",
  "displayName": "Starknet.id",
  "host": {
    "goerli-alpha": "goerli.app.starknet.id",
    "mainnet-alpha": "app.starknet.id"
  },
  "description": "Identity and naming service for starknet",
  "categories": [
    "nft",
    "digitalid"
  ],
  "contracts": [
    {
      "tag": "starknet_id_address",
      "addresses": {
        "goerli-alpha": [
          "0x0798e884450c19e072d6620fefdbeb7387d0453d3fd51d95f5ace1f17633d88b",
          "0x0783a9097b26eae0586373b2ce0ed3529ddc44069d1e0fbc4f66d42b69d6850d"
        ],
        "mainnet-alpha": [
          "0x05dbdedc203e92749e2e746e2d40a768d966bd243df04a6b712e222bc040a9af"
        ]
      }
    },
    {
      "tag": "starknet_id_domain_address",
      "addresses": {
        "goerli-alpha": [
          "0x5cf267a0af6101667013fc6bd3f6c11116a14cda9b8c4b1198520d59f900b17",
          "0x003bab268e932d2cecd1946f100ae67ce3dff9fd234119ea2f6da57d16d29fce"
        ],
        "mainnet-alpha": [
          "0x06ac597f8116f886fa1c97a23fa4e08299975ecaf6b598873ca6792b9bbfb678"
        ]
      }
    },
    {
      "tag": "starknet_id_quest",
      "addresses": {
        "goerli-alpha": [
          "0x068c6b0cab1423338dd3ee6affb14a8e53ec0c64c27075d6137f6b8d2b4ccc73"
        ]
      }
    },
    {
      "tag": "starknet_id_subdomain_address",
      "addresses": {
        "goerli-alpha": [
          "0x0660b2cd3c93528d4edf790610404414ba3f03e0d45c814d686d628583cb34de"
        ],
        "mainnet-alpha": [
          "0x3448896d4a0df143f98c9eeccc7e279bf3c2008bda2ad2759f5b20ed263585f"
        ]
      }
    },
    {
      "tag": "starknet_id_verifier",
      "addresses": {
        "goerli-alpha": [
          "0x4d546c8d60cfd591557ac0613be5ceeb0ea6f797e7d11c0b5160d145fa3089f"
        ],
        "mainnet-alpha": [
          "0x0480258f58d43fb73936f803780047a0f6d0a563697d80bd3f95b603f9c8b1c8"
        ]
      }
    }
  ]
}
