{
    "id": "flex",
    "displayName": "Flex",
    "description":  "The 1st Dynamic Marketplace for Starknet",
    "host": "flexing.gg",
    "categories": ["nft", "mobile"],
    "contracts": [
      {
        "tag": "flex_marketplace",
        "addresses": {
          "mainnet-alpha": [
            "0x703d3e6ea6736b59857e4a2107d439dc7a8b28adfbd48b5e87c024a7df3a51a"
          ]
        }
      }
    ]
  }
  