{
  "id": "realms",
  "displayName": "Realms",
  "host": {
    "goerli-alpha": "goerli-beta.realms.world",
    "mainnet-alpha": "realms.world"
  },
  "description": "The Realms Autonomous World is an on-chain open gaming environment being terraformed by the Bibliotheca DAO, that evolved out of the Loot Universe",
  "categories": [
    "gamefi", "nft"
  ],
  "contracts": [
    {
      "tag": "realms_lords",
      "implements": [
        "erc20"
      ],
      "addresses": {
        "goerli-alpha": [
          "0x0488c4091e5c57309f4acdce4f746898a82f50351d8c85278ad2e877c8c032bd"
        ],
        "mainnet-alpha": [
          "0x0124aeb495b947201f5fac96fd1138e326ad86195b98df6dec9009158a533b49"
        ]
      }
    },
    {
      "tag": "lords_bridge",
      "addresses": {
        "goerli-alpha": [
          "0x042331a29c53f6084f08964cbd83b94c1a141e6d14009052d55b03793b21d5b3"
        ],
        "mainnet-alpha": [
          "0x7c76a71952ce3acd1f953fd2a3fda8564408b821ff367041c89f44526076633"
        ]
      }
    }
  ]
}
