{
  "id": "ninth",
  "displayName": "The Ninth",
  "host": "ninth.gg",
  "description": "The Ninth is a Player-Made and revolutionary Real-Time Evolving Game that gives you the power to shape the game's development and determine the future. You'll be in control like never before in this fully-on-chain and crypto-native game with endless possibilities and a constantly evolving ecosystem.",
  "categories": [
    "gamefi"
  ],
  "contracts": [
    {
      "tag": "ninth_token",
      "implements": [
        "erc20"
      ],
      "addresses": {
        "goerli-alpha": [
          "0x06fbd3f381ddcdf541d361a938717e97ff12ba3c77e4f96f9517d79055123293"
        ]
      }
    },
    {
      "tag": "ninth_koma",
      "addresses": {
        "goerli-alpha": [
          "0x0192e5bc40dc9ef4ce7b7dcdf07c8c6adda7d138989ef918caf741eb93a85e49"
        ]
      }
    }
  ]
}