{
  "id": "briq",
  "displayName": "briq",
  "host": "briq.construction",
  "description": "NFT building and composition protocol. Get some briqs and build the dream.",
  "categories": [
    "nft"
  ],
  "contracts": [
    {
      "tag": "briq_world",
      "addresses": {
        "mainnet-alpha": [
          "0x01ea16366a82e211a9b9045725309a5080c0260d5caf45c58836fc61b42501f5"
        ]
      }
    },
    {
      "tag": "briq_factory",
      "addresses": {
        "mainnet-alpha": [
          "0x075341b8090a4257f22dafffe3a4cb882006bd26302720d6a80a1fde154a3430"
        ]
      }
    },
    {
      "tag": "briq_token",
      "addresses": {
        "mainnet-alpha": [
          "0x02417eb26d02947416ed0e9d99c7a023e3565fc895ee21a0a0ef88a524a665d6"
        ]
      }
    },
    {
      "tag": "box_nft_starknet_planet",
      "addresses": {
        "mainnet-alpha": [
          "0x073e3b5e6c7924f752a158c2b07f606bd5b885029da0ac1e3cde254985303f50"
        ]
      }
    },
    {
      "tag": "box_nft_briqmas",
      "addresses": {
        "mainnet-alpha": [
          "0x069699ce808b5459a3b652b5378f8c141e1dc79e10f4e7b486439fd989b7dfb1"
        ]
      }
    },
    {
      "tag": "booklet_ducks_everywhere",
      "addresses": {
        "mainnet-alpha": [
          "0x03311cdef78f70c1b13568e6dabda043c5e9d2736c0c02a35aa906d91d69836b"
        ]
      }
    },
    {
      "tag": "booklet_starknet_planet",
      "addresses": {
        "mainnet-alpha": [
          "0x02fd50e1bdd7400a8fc97eb63aa4f3423a7ec72ebe78d413ce410ec60a35afea"
        ]
      }
    },
    {
      "tag": "booklet_briqmas",
      "addresses": {
        "mainnet-alpha": [
          "0x04bbb2000c80ff79c2aa3b8aa83ee69c103469181a19d01d7f3ee4313a8031"
        ]
      }
    },
    {
      "tag": "booklet_ducks_frens",
      "addresses": {
        "mainnet-alpha": [
          "0x035d3f5be7b3b06a2d02a539faecd45bf4a04644aee7290359bd595047929a92"
        ]
      }
    },
    {
      "tag": "set_nft",
      "addresses": {
        "mainnet-alpha": [
          "0x03f96949d14c65ec10e7544d93f298d0cb07c498ecb733774f1d4b2adf3ffb23"
        ]
      }
    },
    {
      "tag": "set_nft_ducks_everywhere",
      "addresses": {
        "mainnet-alpha": [
          "0x04fa864a706e3403fd17ac8df307f22eafa21b778b73353abf69a622e47a2003"
        ]
      }
    },
    {
      "tag": "set_nft_starknet_planet",
      "addresses": {
        "mainnet-alpha": [
          "0x0e9b982bdcbed7fa60e5bbf733249ff58da9fe935067656e8175d694162df3"
        ]
      }
    },
    {
      "tag": "set_nft_briqmas",
      "addresses": {
        "mainnet-alpha": [
          "0x012a6eeb4a3eecaf16667e2b630963a4c215cdf3715fb271370a02ed6e8c1942"
        ]
      }
    },
    {
      "tag": "set_nft_1155_ducks_frens",
      "addresses": {
        "mainnet-alpha": [
          "0x0433a83c97c083470a1e2f47e24cbc53c4a225f69ffc045580a7279e7f077c79"
        ]
      }
    },
    {
      "tag": "briq_token (old)",
      "addresses": {
        "goerli-alpha": [
          "0x01317354276941f7f799574c73fd8fe53fa3f251084b4c04d88cf601b6bd915e"
        ],
        "mainnet-alpha": [
          "0x00247444a11a98ee7896f9dec18020808249e8aad21662f2fa00402933dce402"
        ]
      }
    },
    {
      "tag": "briq_set (old)",
      "implements": [
        "erc721"
      ],
      "addresses": {
        "goerli-alpha": [
          "0x0266b1276d23ffb53d99da3f01be7e29fa024dd33cd7f7b1eb7a46c67891c9d0"
        ],
        "mainnet-alpha": [
          "0x01435498bf393da86b4733b9264a86b58a42b31f8d8b8ba309593e5c17847672"
        ]
      }
    },
    {
      "tag": "briq_booklet (old)",
      "addresses": {
        "mainnet-alpha": [
          "0x05faa82e2aec811d3a3b14c1f32e9bbb6c9b4fd0cd6b29a823c98c7360019aa4"
        ]
      }
    },
    {
      "tag": "briq_box (old)",
      "addresses": {
        "mainnet-alpha": [
          "0x01e1f972637ad02e0eed03b69304344c4253804e528e1a5dd5c26bb2f23a8139"
        ]
      }
    },
    {
      "tag": "briq_auctions (old)",
      "addresses": {
        "mainnet-alpha": [
          "0x00b9bb7650a88f7e375ae8d31d48b4d4f13c6c34344839837d7dae7ffcdd3df0",
          "0x01712e3e3f133b26d65a3c5aaae78e7405dfca0a3cfe725dd57c4941d9474620"
        ]
      }
    },
    {
      "tag": "briq_attr_registry (old)",
      "addresses": {
        "mainnet-alpha": [
          "0x008d4f5b0830bd49a88730133a538ccaca3048ccf2b557114b1076feeff13c11"
        ]
      }
    },
    {
      "tag": "briq_shape_registry (old)",
      "addresses": {
        "mainnet-alpha": [
          "0x04848d0dd8a296352ba4fe100fed9d6f44cbd0a8d360b7d551d986732a14791a"
        ]
      }
    }
  ]
}
