{
  "id": "StarkEx",
  "displayName": "StarkEx",
  "host": "starkex.org",
  "description": "StarkEx——AMM,Liquidity Farms,and Reward pools on StarkNet. StarkEx is also a community-based and open-source ecosystem for DeFi! Say goodbye to CeFi!",
  "categories": [
    "defi"
  ],
  "contracts": [
    {
      "tag": "starkex_address",
      "addresses": {
        "mainnet-alpha": [
          "0x07ebd0e95dfc4411045f9424d45a0f132d3e40642c38fdfe0febacf78cc95e76"
        ]
      }
    },
    {
      "tag": "starkex_factory",
      "addresses": {
        "mainnet-alpha": [
          "0x07df3bce30857e8f9c08bcd9d9668df34166e94dd968db6e2920b870c4410e34"
        ]
      }
    }
  ]
}
