{
    "id": "nimbora",
    "displayName": "Nimbora",
    "host": {
        "goerli-alpha": "testnet.nimbora.io",
        "mainnet-alpha": "app.nimbora.io/referral/?ref=zJ5q5ztQ"
    },
    "description": "Nimbora is a highly efficient platform that offers the opportunity to interact with favorite Layer 1 (L1) protocols at a fraction of the cost of Layer 2 (L2) solutions. Nimbora makes DeFi actions a simple 1-click process and offers faster transactions and much lower gas fees.",
    "categories": [
        "defi"
    ],
    "contracts": [
        {
            "tag": "275% Trove",
            "addresses": {
                "mainnet-alpha": [
                    "0x03580a65260563b5511ddf2eafb83d6b309dce7fc25271df8c040a437f09a399"
                ]
            }
        },
        {
            "tag": "400% Trove",
            "addresses": {
                "mainnet-alpha": [
                    "0x02a67288e48a8c4e2881aee422da7841fc11fef195e0a81f929871c77f07509d"
                ]
            }
        },
        {
            "tag": "Nimbora Pendle EtherFi Eth",
            "implements": [
                "erc20"
            ],
            "addresses": {
                "mainnet-alpha": [
                    "0x316ec509f7ad89b7e6e03d15a436df634454f95e815536d616af03edc850fa3"
                ]
            }
        },
        {
            "tag": "Nimbora Savings Dai",
            "implements": [
                "erc20"
            ],
            "addresses": {
                "mainnet-alpha": [
                    "0x4380de5819e2e989b5e8b978ea2811fd36fdbc5c12fcfb3a2b444098888665"
                ]
            }
        },
        {
            "tag": "Nimbora Pendle Puffer Eth",
            "implements": [
                "erc20"
            ],
            "addresses": {
                "mainnet-alpha": [
                    "0x357cba05d61beb5fe378429d25013dc5fe0f67878b541747b0675c5ebecee1"
                ]
            }
        },
        {
            "tag": "Nimbora Pendle Flux Usdc",
            "implements": [
                "erc20"
            ],
            "addresses": {
                "mainnet-alpha": [
                    "0x52bdb85297e6b0c87d8ec98c5195a4324ff731676d64d9bee2e9e8710e8ea52"
                ]
            }
        },
        {
            "tag": "Nimbora Pendle Aave Usdt",
            "implements": [
                "erc20"
            ],
            "addresses": {
                "mainnet-alpha": [
                    "0x40daf98c49c6104002428958456208455a03825198fa7646bd793a321f4fc82"
                ]
            }
        }
    ]
}
