{
    "id": "pyramid",
    "displayName": "Pyramid",
    "host": "pyramid.market",
    "description":  "Discover a new dimension on Pyramid NFT Marketplace, Collect and trade, unique digital assets powered by Dolven Labs and StarkGuardians Built on Starknet",
    "categories": ["nft", "infra"],
    "contracts": [
      {
        "tag": "marketplace",
        "addresses": {
          "mainnet-alpha": [
            "0x364847c4f39b869760a8b213186b5b553127e9420e594075d13d1ce8a1d9157"
          ]
        }
      }
    ]
  }

